{
  "schema_version": "1.0.0",
  "synced_at": "2026-06-01T18:51:26.563Z",
  "sources": {
    "hf_leaderboard": {
      "url": "https://huggingface.co/datasets/open-llm-leaderboard/contents",
      "synced_at": "2026-06-01T18:51:25.691Z",
      "record_count": 1000
    },
    "artificial_analysis": {
      "url": "https://openrouter.ai/api/v1/models",
      "synced_at": "2026-06-01T18:51:26.067Z",
      "record_count": 343
    },
    "lmarena": {
      "url": "https://raw.githubusercontent.com/fboulnois/llm-leaderboard-csv/main/csv/lmarena_text.csv",
      "synced_at": "2026-06-01T18:51:26.215Z",
      "record_count": 266
    },
    "bigcode_leaderboard": {
      "url": "https://huggingface.co/spaces/bigcode/bigcode-models-leaderboard/resolve/main/data/code_eval_board.csv",
      "synced_at": "2026-06-01T18:51:26.547Z",
      "record_count": 60
    }
  },
  "dimensions": {
    "quality.arena_elo": {
      "label": "Arena Elo",
      "unit": null,
      "direction": "higher_better",
      "source": "lmarena"
    },
    "quality.composite_score": {
      "label": "Composite",
      "unit": null,
      "direction": "higher_better",
      "source": "derived"
    },
    "quality.reasoning.gpqa": {
      "label": "GPQA",
      "unit": null,
      "direction": "higher_better",
      "source": "hf_leaderboard"
    },
    "quality.reasoning.mmlu_pro": {
      "label": "MMLU-Pro",
      "unit": null,
      "direction": "higher_better",
      "source": "hf_leaderboard"
    },
    "quality.coding.humaneval": {
      "label": "HumanEval",
      "unit": null,
      "direction": "higher_better",
      "source": "bigcode_leaderboard"
    },
    "quality.coding.livecodebench": {
      "label": "LiveCodeBench",
      "unit": null,
      "direction": "higher_better",
      "source": "hf_leaderboard"
    },
    "quality.coding.swe_bench": {
      "label": "SWE-bench",
      "unit": null,
      "direction": "higher_better",
      "source": "hf_leaderboard"
    },
    "performance.latency_ttft_ms": {
      "label": "Latency (TTFT)",
      "unit": "ms",
      "direction": "lower_better",
      "source": "artificial_analysis"
    },
    "performance.throughput_tok_s": {
      "label": "Throughput",
      "unit": "tok/s",
      "direction": "higher_better",
      "source": "artificial_analysis"
    },
    "pricing_hosted.input_per_mtok_usd": {
      "label": "$/M in",
      "unit": "USD",
      "direction": "lower_better",
      "source": "artificial_analysis"
    },
    "pricing_hosted.output_per_mtok_usd": {
      "label": "$/M out",
      "unit": "USD",
      "direction": "lower_better",
      "source": "artificial_analysis"
    },
    "context_window": {
      "label": "Context",
      "unit": "tokens",
      "direction": "higher_better",
      "source": "models_yaml"
    },
    "vram_estimate_gb.q4": {
      "label": "VRAM @ q4",
      "unit": "GB",
      "direction": "lower_better",
      "source": "derived"
    },
    "vram_estimate_gb.q8": {
      "label": "VRAM @ q8",
      "unit": "GB",
      "direction": "lower_better",
      "source": "derived"
    },
    "vram_estimate_gb.fp16": {
      "label": "VRAM @ fp16",
      "unit": "GB",
      "direction": "lower_better",
      "source": "derived"
    },
    "params.total_b": {
      "label": "Params (total)",
      "unit": "B",
      "direction": "informational",
      "source": "models_yaml"
    },
    "params.active_b": {
      "label": "Params (active)",
      "unit": "B",
      "direction": "informational",
      "source": "models_yaml"
    }
  },
  "models": [
    {
      "model_id": "qwen3-72b",
      "name": "Qwen3 72B",
      "family": "qwen3",
      "vendor": "alibaba",
      "release_date": "2025-04-01",
      "license": {
        "id": "qwen-license",
        "name": "Qwen License",
        "osi_approved": false,
        "url": "https://huggingface.co/Qwen"
      },
      "params": {
        "total_b": 72,
        "active_b": 72,
        "is_moe": false
      },
      "context_window": 131072,
      "modalities": {
        "input": [
          "text"
        ],
        "output": [
          "text"
        ]
      },
      "vram_estimate_gb": {
        "q4": 43.2,
        "q8": 86.4,
        "fp16": 172.8
      },
      "quality": {
        "arena_elo": null,
        "composite_score": null,
        "reasoning": {
          "gpqa": null,
          "mmlu_pro": null
        },
        "coding": {
          "humaneval": null,
          "livecodebench": null,
          "swe_bench": null
        }
      },
      "performance": {
        "latency_ttft_ms": null,
        "throughput_tok_s": null
      },
      "pricing_hosted": {
        "input_per_mtok_usd": null,
        "output_per_mtok_usd": null,
        "provider_count": null
      },
      "model_card_url": "https://huggingface.co/Qwen/Qwen3-72B",
      "sources_used": [],
      "missing_fields": [
        "quality.arena_elo",
        "quality.reasoning.gpqa",
        "quality.reasoning.mmlu_pro",
        "quality.coding.humaneval",
        "quality.coding.livecodebench",
        "quality.coding.swe_bench",
        "performance.latency_ttft_ms",
        "performance.throughput_tok_s",
        "pricing_hosted.input_per_mtok_usd",
        "pricing_hosted.output_per_mtok_usd"
      ]
    },
    {
      "model_id": "qwen3-32b",
      "name": "Qwen3 32B",
      "family": "qwen3",
      "vendor": "alibaba",
      "release_date": "2025-04-01",
      "license": {
        "id": "qwen-license",
        "name": "Qwen License",
        "osi_approved": false,
        "url": "https://huggingface.co/Qwen"
      },
      "params": {
        "total_b": 32,
        "active_b": 32,
        "is_moe": false
      },
      "context_window": 131072,
      "modalities": {
        "input": [
          "text"
        ],
        "output": [
          "text"
        ]
      },
      "vram_estimate_gb": {
        "q4": 19.2,
        "q8": 38.4,
        "fp16": 76.8
      },
      "quality": {
        "arena_elo": 1341,
        "composite_score": null,
        "reasoning": {
          "gpqa": null,
          "mmlu_pro": null
        },
        "coding": {
          "humaneval": null,
          "livecodebench": null,
          "swe_bench": null
        }
      },
      "performance": {
        "latency_ttft_ms": null,
        "throughput_tok_s": null
      },
      "pricing_hosted": {
        "input_per_mtok_usd": 0.08,
        "output_per_mtok_usd": 0.28,
        "provider_count": null
      },
      "model_card_url": "https://huggingface.co/Qwen/Qwen3-32B",
      "sources_used": [
        "artificial_analysis",
        "lmarena"
      ],
      "missing_fields": [
        "quality.reasoning.gpqa",
        "quality.reasoning.mmlu_pro",
        "quality.coding.humaneval",
        "quality.coding.livecodebench",
        "quality.coding.swe_bench",
        "performance.latency_ttft_ms",
        "performance.throughput_tok_s"
      ]
    },
    {
      "model_id": "qwen3-7b",
      "name": "Qwen3 7B",
      "family": "qwen3",
      "vendor": "alibaba",
      "release_date": "2025-04-01",
      "license": {
        "id": "qwen-license",
        "name": "Qwen License",
        "osi_approved": false,
        "url": "https://huggingface.co/Qwen"
      },
      "params": {
        "total_b": 7,
        "active_b": 7,
        "is_moe": false
      },
      "context_window": 131072,
      "modalities": {
        "input": [
          "text"
        ],
        "output": [
          "text"
        ]
      },
      "vram_estimate_gb": {
        "q4": 4.2,
        "q8": 8.4,
        "fp16": 16.8
      },
      "quality": {
        "arena_elo": null,
        "composite_score": null,
        "reasoning": {
          "gpqa": null,
          "mmlu_pro": null
        },
        "coding": {
          "humaneval": null,
          "livecodebench": null,
          "swe_bench": null
        }
      },
      "performance": {
        "latency_ttft_ms": null,
        "throughput_tok_s": null
      },
      "pricing_hosted": {
        "input_per_mtok_usd": null,
        "output_per_mtok_usd": null,
        "provider_count": null
      },
      "model_card_url": "https://huggingface.co/Qwen/Qwen3-7B",
      "sources_used": [],
      "missing_fields": [
        "quality.arena_elo",
        "quality.reasoning.gpqa",
        "quality.reasoning.mmlu_pro",
        "quality.coding.humaneval",
        "quality.coding.livecodebench",
        "quality.coding.swe_bench",
        "performance.latency_ttft_ms",
        "performance.throughput_tok_s",
        "pricing_hosted.input_per_mtok_usd",
        "pricing_hosted.output_per_mtok_usd"
      ]
    },
    {
      "model_id": "deepseek-v3",
      "name": "DeepSeek V3",
      "family": "deepseek",
      "vendor": "deepseek",
      "release_date": "2024-12-26",
      "license": {
        "id": "deepseek-license",
        "name": "DeepSeek License",
        "osi_approved": false,
        "url": "https://github.com/deepseek-ai/DeepSeek-LLM/blob/main/LICENSE-MODEL"
      },
      "params": {
        "total_b": 671,
        "active_b": 37,
        "is_moe": true
      },
      "context_window": 128000,
      "modalities": {
        "input": [
          "text"
        ],
        "output": [
          "text"
        ]
      },
      "vram_estimate_gb": {
        "q4": 402.6,
        "q8": 805.2,
        "fp16": 1610.4
      },
      "quality": {
        "arena_elo": 1376,
        "composite_score": null,
        "reasoning": {
          "gpqa": null,
          "mmlu_pro": null
        },
        "coding": {
          "humaneval": null,
          "livecodebench": null,
          "swe_bench": null
        }
      },
      "performance": {
        "latency_ttft_ms": null,
        "throughput_tok_s": null
      },
      "pricing_hosted": {
        "input_per_mtok_usd": 0.2288,
        "output_per_mtok_usd": 0.3432,
        "provider_count": null
      },
      "model_card_url": "https://huggingface.co/deepseek-ai/DeepSeek-V3",
      "sources_used": [